{
  "$schema": "https://json-schema.org/draft/2020-12/schema",
  "$id": "qualification-revocation-state-receipt.schema.json",
  "title": "OpenAdapt qualification revocation state receipt v1",
  "type": "object",
  "additionalProperties": false,
  "required": [
    "schema_version", "revocation_state_sha256", "previous_revocation_state_sha256",
    "revision", "status", "authority_state_sha256", "signer_registry_sha256",
    "revocations", "observed_at", "not_before", "expires_at", "issuer_key_id",
    "algorithm", "signing_statement", "signature", "issuer"
  ],
  "properties": {
    "schema_version": {"const": "openadapt.qualification-revocation-state-receipt/v1"},
    "revocation_state_sha256": {"$ref": "#/$defs/digest"},
    "previous_revocation_state_sha256": {"oneOf": [{"$ref": "#/$defs/digest"}, {"type": "null"}]},
    "revision": {"type": "integer", "minimum": 1},
    "status": {"const": "current"},
    "authority_state_sha256": {"$ref": "#/$defs/digest"},
    "signer_registry_sha256": {"$ref": "#/$defs/digest"},
    "revocations": {"type": "array", "uniqueItems": true, "items": {"$ref": "#/$defs/revocation"}},
    "observed_at": {"$ref": "#/$defs/timestamp"},
    "not_before": {"$ref": "#/$defs/timestamp"},
    "expires_at": {"oneOf": [{"$ref": "#/$defs/timestamp"}, {"type": "null"}]},
    "issuer_key_id": {"type": "string", "pattern": "^qa-ed25519-[0-9a-f]{16}$"},
    "algorithm": {"const": "ed25519"},
    "signing_statement": {
      "allOf": [
        {"$ref": "qualification-evidence-signing-statement.schema.json"},
        {"properties": {
          "object_schema_version": {
            "const": "openadapt.qualification-revocation-state-receipt/v1"
          },
          "signature_domain": {
            "const": "OpenAdapt qualification revocation state receipt v1\u0000"
          }
        }}
      ]
    },
    "signature": {"type": "string", "pattern": "^[A-Za-z0-9+/]{86}==$"},
    "issuer": {"$ref": "#/$defs/issuer"}
  },
  "$defs": {
    "digest": {"type": "string", "pattern": "^sha256:[0-9a-f]{64}$"},
    "commit": {"type": "string", "pattern": "^[0-9a-f]{40}$"},
    "timestamp": {"type": "string", "pattern": "^[0-9]{4}-[0-9]{2}-[0-9]{2}T[0-9]{2}:[0-9]{2}:[0-9]{2}Z$"},
    "revocation": {
      "type": "object",
      "additionalProperties": false,
      "required": ["subject_kind", "subject_id", "revoked_at", "reason_code"],
      "properties": {
        "subject_kind": {"type": "string", "pattern": "^[a-z][a-z0-9-]*$"},
        "subject_id": {"type": "string", "minLength": 1, "maxLength": 256},
        "revoked_at": {"$ref": "#/$defs/timestamp"},
        "reason_code": {"type": "string", "pattern": "^[a-z][a-z0-9_]*$"}
      }
    },
    "issuer": {
      "type": "object",
      "additionalProperties": false,
      "required": ["repository", "repository_id", "repository_owner_id", "workflow", "ref", "source_commit", "environment"],
      "properties": {
        "repository": {"const": "OpenAdaptAI/openadapt-ops"},
        "repository_id": {"const": "1172011294"},
        "repository_owner_id": {"const": "132681217"},
        "workflow": {"const": ".github/workflows/qualification-revocation-state.yml"},
        "ref": {"const": "refs/heads/main"},
        "source_commit": {"$ref": "#/$defs/commit"},
        "environment": {"const": "qualification-revocation-state"}
      }
    }
  }
}
