{"algorithm":"ed25519","authority_state_sha256":"sha256:ea973da8b764f89a56e9f74100c049d3c5d92d8e31b2a42131651242aca44dfb","expires_at":"2026-09-09T17:59:26Z","issuer":{"environment":"qualification-revocation-state","ref":"refs/heads/main","repository":"OpenAdaptAI/openadapt-ops","repository_id":"1172011294","repository_owner_id":"132681217","source_commit":"e323249e3a7c1af9d7651312e0afe1f12c38c977","workflow":".github/workflows/qualification-revocation-state.yml"},"issuer_key_id":"qa-ed25519-9cf4bca214c01d79","not_before":"2026-09-02T17:59:26Z","observed_at":"2026-09-02T17:59:26Z","previous_revocation_state_sha256":null,"revision":1,"revocation_state_sha256":"sha256:36fa86bae55a9a5577c5f173ab1efcb3f66a8c24a0b2a3e5efad6f5bbc5aa78e","revocations":[],"schema_version":"openadapt.qualification-revocation-state-receipt/v1","signature":"uHJF0u98zXwrOeYrb4N4pFCR0PMX84CR/VFtXh3vEAiA1RdfK2QyVyeLI4HQsPrIk73y8g7JwvnRkdLerB1tBQ==","signer_registry_sha256":"sha256:728e0d4f7c2a85a256ae3bf95a3ed56708daf818252c2b19525efc61e81ca1bc","signing_statement":{"commitment_scheme":"sha256-canonical-json-lf","object_schema_version":"openadapt.qualification-revocation-state-receipt/v1","schema_version":"openadapt.qualification-evidence-signing-statement/v1","signature_domain":"OpenAdapt qualification revocation state receipt v1\u0000","unsigned_object_sha256":"sha256:846b7d68833a00b5bd56e1ef63f4173a5f76357037cfaea3c546e3f6f20c9685","unsigned_size_bytes":948},"status":"current"}
